{
  "event_id": "c4e91b20-8a1d-4f3c-9e6b-2d7f4a81c903",
  "event_type": "contact_received",
  "event_version": 1,
  "occurred_at": "2026-08-27T07:45:00Z",
  "source": "shopware",
  "sales_channel_id": "018f1a2b3c4d5e6f7890abcdef123456",
  "market_code": "de",
  "domain": "jvmoebel.de",
  "language": "de-DE",
  "contact_id": "018f7777777777777777777777777788",
  "lead_id": "018f1111111111111111111111111111",
  "aggregate_type": "contact",
  "aggregate_id": "018f7777777777777777777777777788",
  "aggregate_version": 1,
  "payload": {
    "contact_channel": "phone",
    "contact_type": "qualified_call",
    "provider_reference": "call-123",
    "tracking_reference": "trk-call-9a21",
    "duration_seconds": 185,
    "connection_status": "answered"
  }
}
