{
  "event_id": "a89130a8-7be8-4bc1-8848-8366a293e4c7",
  "event_type": "contact_received",
  "event_version": 1,
  "occurred_at": "2026-08-27T07:30:00Z",
  "source": "shopware",
  "sales_channel_id": "018f1a2b3c4d5e6f7890abcdef123456",
  "market_code": "de",
  "domain": "jvmoebel.de",
  "language": "de-DE",
  "contact_id": "018f7777777777777777777777777777",
  "lead_id": "018f1111111111111111111111111111",
  "aggregate_type": "contact",
  "aggregate_id": "018f7777777777777777777777777777",
  "aggregate_version": 1,
  "payload": {
    "contact_channel": "email",
    "contact_type": "direct_email",
    "provider_reference": "mail-784512"
  }
}
